{
  "$schema": "../../../tools/SvcSystems.AI.AgentClientProtocol.Generator/schema-generator-options.schema.json",
  "namespace": "SvcSystems.AI.AgentClientProtocol.Models",
  "clientNamespace": "SvcSystems.AI.AgentClientProtocol.Client.Models",
  "agentNamespace": "SvcSystems.AI.AgentClientProtocol.Agent.Models",
  "serializationNamespace": "SvcSystems.AI.AgentClientProtocol.Serialization",
  "generateJsonContext": true,
  "allowUnknownDiscriminators": ["ContentBlock", "SessionConfigOption", "SessionUpdate", "ToolCallContent"],
  "defaultUnionCases": {
    "SessionConfigSelectOptions": "Ungrouped"
  }
}
